uuid;name;description;local-name;local-description;class;datatype;shortname;is-set;reference-term-source;reference-term-code;reference-term-name;reference-term-relationship;units;high-normal;low-normal;member-of;member-of-sort-weight;answer-of;answer-of-sort-weight
;Malignant neoplasm of other connective and soft tissue;;;;Diagnosis;N/A;;FALSE;ICD10-BD;C49;;SAME-AS;;;;;;;
;Malignant neoplasm of connective and soft tissue of head, face, and neck;;;;Diagnosis;N/A;;FALSE;ICD10-BD;C49.0;;SAME-AS;;;;;;;
;Malignant neoplasm of connective and soft tissue of upper limb, including shoulder;;;;Diagnosis;N/A;;FALSE;ICD10-BD;C49.1;;SAME-AS;;;;;;;
;Malignant neoplasm of connective and soft tissue of lower limb, including hip;;;;Diagnosis;N/A;;FALSE;ICD10-BD;C49.2;;SAME-AS;;;;;;;
;Malignant neoplasm of connective and soft tissue of thorax;;;;Diagnosis;N/A;;FALSE;ICD10-BD;C49.3;;SAME-AS;;;;;;;
;Malignant neoplasm of connective and soft tissue of abdomen;;;;Diagnosis;N/A;;FALSE;ICD10-BD;C49.4;;SAME-AS;;;;;;;
;Malignant neoplasm of connective and soft tissue of pelvis;;;;Diagnosis;N/A;;FALSE;ICD10-BD;C49.5;;SAME-AS;;;;;;;
;Malignant neoplasm of connective and soft tissue of trunk, unspecified;;;;Diagnosis;N/A;;FALSE;ICD10-BD;C49.6;;SAME-AS;;;;;;;
;Malignant neoplasm of overlapping lesion of connective and soft tissue;;;;Diagnosis;N/A;;FALSE;ICD10-BD;C49.8;;SAME-AS;;;;;;;
;Malignant neoplasm of connective and soft tissue, unspecified;;;;Diagnosis;N/A;;FALSE;ICD10-BD;C49.9;;SAME-AS;;;;;;;
;Malignant neoplasm of breast;;;;Diagnosis;N/A;;FALSE;ICD10-BD;C50;;SAME-AS;;;;;;;
;Malignant neoplasm of breast;;;;Diagnosis;N/A;;FALSE;ICD10-BD;C50;;SAME-AS;;;;;;;
;Malignant neoplasm of nipple and areola;;;;Diagnosis;N/A;;FALSE;ICD10-BD;C50.0;;SAME-AS;;;;;;;
;Malignant neoplasm of central portion of breast;;;;Diagnosis;N/A;;FALSE;ICD10-BD;C50.1;;SAME-AS;;;;;;;
;Malignant neoplasm of upper-inner quadrant of breast;;;;Diagnosis;N/A;;FALSE;ICD10-BD;C50.2;;SAME-AS;;;;;;;
;Malignant neoplasm of lower-inner quadrant of breast;;;;Diagnosis;N/A;;FALSE;ICD10-BD;C50.3;;SAME-AS;;;;;;;
;Malignant neoplasm of upper-outer quadrant of breast;;;;Diagnosis;N/A;;FALSE;ICD10-BD;C50.4;;SAME-AS;;;;;;;
;Malignant neoplasm of lower-outer quadrant of breast;;;;Diagnosis;N/A;;FALSE;ICD10-BD;C50.5;;SAME-AS;;;;;;;
;Malignant neoplasm of axillary tail of breast;;;;Diagnosis;N/A;;FALSE;ICD10-BD;C50.6;;SAME-AS;;;;;;;
;Malignant neoplasm of overlapping lesion of breast;;;;Diagnosis;N/A;;FALSE;ICD10-BD;C50.8;;SAME-AS;;;;;;;
;Malignant neoplasm of breast, unspecified;;;;Diagnosis;N/A;;FALSE;ICD10-BD;C50.9;;SAME-AS;;;;;;;
;Malignant neoplasm of vulva;;;;Diagnosis;N/A;;FALSE;ICD10-BD;C51;;SAME-AS;;;;;;;
;Malignant neoplasm of labium majus;;;;Diagnosis;N/A;;FALSE;ICD10-BD;C51.0;;SAME-AS;;;;;;;
;Malignant neoplasm of labium minus;;;;Diagnosis;N/A;;FALSE;ICD10-BD;C51.1;;SAME-AS;;;;;;;
;Malignant neoplasm of clitoris;;;;Diagnosis;N/A;;FALSE;ICD10-BD;C51.2;;SAME-AS;;;;;;;
;Malignant neoplasm of overlapping lesion of vulva;;;;Diagnosis;N/A;;FALSE;ICD10-BD;C51.8;;SAME-AS;;;;;;;
;Malignant neoplasm of vulva, unspecified;;;;Diagnosis;N/A;;FALSE;ICD10-BD;C51.9;;SAME-AS;;;;;;;
;Malignant neoplasm of vagina;;;;Diagnosis;N/A;;FALSE;ICD10-BD;C52;;SAME-AS;;;;;;;
;Malignant neoplasm of cervix uteri;;;;Diagnosis;N/A;;FALSE;ICD10-BD;C53;;SAME-AS;;;;;;;
;Malignant neoplasm of endocervix;;;;Diagnosis;N/A;;FALSE;ICD10-BD;C53.0;;SAME-AS;;;;;;;
;Malignant neoplasm of exocervix;;;;Diagnosis;N/A;;FALSE;ICD10-BD;C53.1;;SAME-AS;;;;;;;
;Malignant neoplasm of overlapping lesion of cervix uteri;;;;Diagnosis;N/A;;FALSE;ICD10-BD;C53.8;;SAME-AS;;;;;;;
;Malignant neoplasm of cervix uteri, unspecified;;;;Diagnosis;N/A;;FALSE;ICD10-BD;C53.9;;SAME-AS;;;;;;;
;Malignant neoplasm of corpus uteri;;;;Diagnosis;N/A;;FALSE;ICD10-BD;C54;;SAME-AS;;;;;;;
;Malignant neoplasm of isthmus uteri;;;;Diagnosis;N/A;;FALSE;ICD10-BD;C54.0;;SAME-AS;;;;;;;
;Malignant neoplasm of endometrium;;;;Diagnosis;N/A;;FALSE;ICD10-BD;C54.1;;SAME-AS;;;;;;;
;Malignant neoplasm of myometrium;;;;Diagnosis;N/A;;FALSE;ICD10-BD;C54.2;;SAME-AS;;;;;;;
;Malignant neoplasm of fundus uteri;;;;Diagnosis;N/A;;FALSE;ICD10-BD;C54.3;;SAME-AS;;;;;;;
;Malignant neoplasm of overlapping lesion of corpus uteri;;;;Diagnosis;N/A;;FALSE;ICD10-BD;C54.8;;SAME-AS;;;;;;;
;Malignant neoplasm of corpus uteri, unspecified;;;;Diagnosis;N/A;;FALSE;ICD10-BD;C54.9;;SAME-AS;;;;;;;
;Malignant neoplasm of uterus, part unspecified;;;;Diagnosis;N/A;;FALSE;ICD10-BD;C55;;SAME-AS;;;;;;;
;Malignant neoplasm of ovary;;;;Diagnosis;N/A;;FALSE;ICD10-BD;C56;;SAME-AS;;;;;;;
;Malignant neoplasm of other and unspecified female genital organs;;;;Diagnosis;N/A;;FALSE;ICD10-BD;C57;;SAME-AS;;;;;;;
;Malignant neoplasm of fallopian tube;;;;Diagnosis;N/A;;FALSE;ICD10-BD;C57.0;;SAME-AS;;;;;;;
;Malignant neoplasm of broad ligament;;;;Diagnosis;N/A;;FALSE;ICD10-BD;C57.1;;SAME-AS;;;;;;;
;Malignant neoplasm of round ligament;;;;Diagnosis;N/A;;FALSE;ICD10-BD;C57.2;;SAME-AS;;;;;;;
;Malignant neoplasm of parametrium;;;;Diagnosis;N/A;;FALSE;ICD10-BD;C57.3;;SAME-AS;;;;;;;
;Malignant neoplasm of uterine adnexa, unspecified;;;;Diagnosis;N/A;;FALSE;ICD10-BD;C57.4;;SAME-AS;;;;;;;
;Malignant neoplasm of other specified female genital organs;;;;Diagnosis;N/A;;FALSE;ICD10-BD;C57.7;;SAME-AS;;;;;;;
;Malignant neoplasm of overlapping lesion of female genital organs;;;;Diagnosis;N/A;;FALSE;ICD10-BD;C57.8;;SAME-AS;;;;;;;
;Malignant neoplasm of female genital organ, unspecified;;;;Diagnosis;N/A;;FALSE;ICD10-BD;C57.9;;SAME-AS;;;;;;;
;Malignant neoplasm of placenta;;;;Diagnosis;N/A;;FALSE;ICD10-BD;C58;;SAME-AS;;;;;;;
;Malignant neoplasm of penis;;;;Diagnosis;N/A;;FALSE;ICD10-BD;C60;;SAME-AS;;;;;;;
;Malignant neoplasm of prepuce;;;;Diagnosis;N/A;;FALSE;ICD10-BD;C60.0;;SAME-AS;;;;;;;
;Malignant neoplasm of glans penis;;;;Diagnosis;N/A;;FALSE;ICD10-BD;C60.1;;SAME-AS;;;;;;;
;Malignant neoplasm of body of penis;;;;Diagnosis;N/A;;FALSE;ICD10-BD;C60.2;;SAME-AS;;;;;;;
;Malignant neoplasm of overlapping lesion of penis;;;;Diagnosis;N/A;;FALSE;ICD10-BD;C60.8;;SAME-AS;;;;;;;
;Malignant neoplasm of penis, unspecified;;;;Diagnosis;N/A;;FALSE;ICD10-BD;C60.9;;SAME-AS;;;;;;;
;Malignant neoplasm of prostate;;;;Diagnosis;N/A;;FALSE;ICD10-BD;C61;;SAME-AS;;;;;;;
;Malignant neoplasm of testis;;;;Diagnosis;N/A;;FALSE;ICD10-BD;C62;;SAME-AS;;;;;;;
;Malignant neoplasm of undescended testis;;;;Diagnosis;N/A;;FALSE;ICD10-BD;C62.0;;SAME-AS;;;;;;;
;Malignant neoplasm of descended testis;;;;Diagnosis;N/A;;FALSE;ICD10-BD;C62.1;;SAME-AS;;;;;;;
;Malignant neoplasm of testis, unspecified;;;;Diagnosis;N/A;;FALSE;ICD10-BD;C62.9;;SAME-AS;;;;;;;
;Malignant neoplasm of other and unspecified male genital organs;;;;Diagnosis;N/A;;FALSE;ICD10-BD;C63;;SAME-AS;;;;;;;
;Malignant neoplasm of epididymis;;;;Diagnosis;N/A;;FALSE;ICD10-BD;C63.0;;SAME-AS;;;;;;;
;Malignant neoplasm of spermatic cord;;;;Diagnosis;N/A;;FALSE;ICD10-BD;C63.1;;SAME-AS;;;;;;;
;Malignant neoplasm of scrotum;;;;Diagnosis;N/A;;FALSE;ICD10-BD;C63.2;;SAME-AS;;;;;;;
;Malignant neoplasm of other specified male genital organs;;;;Diagnosis;N/A;;FALSE;ICD10-BD;C63.7;;SAME-AS;;;;;;;
;Malignant neoplasm of overlapping lesion of male genital organs;;;;Diagnosis;N/A;;FALSE;ICD10-BD;C63.8;;SAME-AS;;;;;;;
;Malignant neoplasm of male genital organ, unspecified;;;;Diagnosis;N/A;;FALSE;ICD10-BD;C63.9;;SAME-AS;;;;;;;
;Malignant neoplasm of kidney, except renal pelvis;;;;Diagnosis;N/A;;FALSE;ICD10-BD;C64;;SAME-AS;;;;;;;
;Malignant neoplasm of renal pelvis;;;;Diagnosis;N/A;;FALSE;ICD10-BD;C65;;SAME-AS;;;;;;;
;Malignant neoplasm of ureter;;;;Diagnosis;N/A;;FALSE;ICD10-BD;C66;;SAME-AS;;;;;;;
;Malignant neoplasm of bladder;;;;Diagnosis;N/A;;FALSE;ICD10-BD;C67;;SAME-AS;;;;;;;
;Trigone of bladder;;;;Diagnosis;N/A;;FALSE;ICD10-BD;C67.0;;SAME-AS;;;;;;;
;Malignant neoplasm of dome of bladder;;;;Diagnosis;N/A;;FALSE;ICD10-BD;C67.1;;SAME-AS;;;;;;;
;Malignant neoplasm of lateral wall of bladder;;;;Diagnosis;N/A;;FALSE;ICD10-BD;C67.2;;SAME-AS;;;;;;;
;Malignant neoplasm of anterior wall of bladder;;;;Diagnosis;N/A;;FALSE;ICD10-BD;C67.3;;SAME-AS;;;;;;;
;Malignant neoplasm of posterior wall of bladder;;;;Diagnosis;N/A;;FALSE;ICD10-BD;C67.4;;SAME-AS;;;;;;;
;Malignant neoplasm of bladder neck;;;;Diagnosis;N/A;;FALSE;ICD10-BD;C67.5;;SAME-AS;;;;;;;
;Malignant neoplasm of ureteric orifice;;;;Diagnosis;N/A;;FALSE;ICD10-BD;C67.6;;SAME-AS;;;;;;;
;Malignant neoplasm of urachus;;;;Diagnosis;N/A;;FALSE;ICD10-BD;C67.7;;SAME-AS;;;;;;;
;Malignant neoplasm of overlapping lesion of bladder;;;;Diagnosis;N/A;;FALSE;ICD10-BD;C67.8;;SAME-AS;;;;;;;
;Malignant neoplasm of bladder, unspecified;;;;Diagnosis;N/A;;FALSE;ICD10-BD;C67.9;;SAME-AS;;;;;;;
;Malignant neoplasm of other and unspecified urinary organs;;;;Diagnosis;N/A;;FALSE;ICD10-BD;C68;;SAME-AS;;;;;;;
;Malignant neoplasm of urethra;;;;Diagnosis;N/A;;FALSE;ICD10-BD;C68.0;;SAME-AS;;;;;;;
;Malignant neoplasm of paraurethral glands;;;;Diagnosis;N/A;;FALSE;ICD10-BD;C68.1;;SAME-AS;;;;;;;
;Malignant neoplasm of overlapping lesion of urinary organs;;;;Diagnosis;N/A;;FALSE;ICD10-BD;C68.8;;SAME-AS;;;;;;;
;Malignant neoplasm of urinary organ, unspecified;;;;Diagnosis;N/A;;FALSE;ICD10-BD;C68.9;;SAME-AS;;;;;;;
;Malignant neoplasm of eye and adnexa;;;;Diagnosis;N/A;;FALSE;ICD10-BD;C69;;SAME-AS;;;;;;;
;Malignant neoplasm of conjunctiva;;;;Diagnosis;N/A;;FALSE;ICD10-BD;C69.0;;SAME-AS;;;;;;;
;Malignant neoplasm of cornea;;;;Diagnosis;N/A;;FALSE;ICD10-BD;C69.1;;SAME-AS;;;;;;;
;Malignant neoplasm of retina;;;;Diagnosis;N/A;;FALSE;ICD10-BD;C69.2;;SAME-AS;;;;;;;
;Malignant neoplasm of choroid;;;;Diagnosis;N/A;;FALSE;ICD10-BD;C69.3;;SAME-AS;;;;;;;
;Malignant neoplasm of ciliary body;;;;Diagnosis;N/A;;FALSE;ICD10-BD;C69.4;;SAME-AS;;;;;;;
;Malignant neoplasm of lacrimal gland and duct;;;;Diagnosis;N/A;;FALSE;ICD10-BD;C69.5;;SAME-AS;;;;;;;
;Malignant neoplasm of orbit;;;;Diagnosis;N/A;;FALSE;ICD10-BD;C69.6;;SAME-AS;;;;;;;
;Malignant neoplasm of overlapping lesion of eye and adnexa;;;;Diagnosis;N/A;;FALSE;ICD10-BD;C69.8;;SAME-AS;;;;;;;
;Malignant neoplasm of eye, unspecified;;;;Diagnosis;N/A;;FALSE;ICD10-BD;C69.9;;SAME-AS;;;;;;;
;Malignant neoplasm of meninges;;;;Diagnosis;N/A;;FALSE;ICD10-BD;C70;;SAME-AS;;;;;;;
;Malignant neoplasm of cerebral meninges;;;;Diagnosis;N/A;;FALSE;ICD10-BD;C70.0;;SAME-AS;;;;;;;
;Malignant neoplasm of spinal meninges;;;;Diagnosis;N/A;;FALSE;ICD10-BD;C70.1;;SAME-AS;;;;;;;
;Malignant neoplasm of meninges, unspecified;;;;Diagnosis;N/A;;FALSE;ICD10-BD;C70.9;;SAME-AS;;;;;;;
;Malignant neoplasm of brain;;;;Diagnosis;N/A;;FALSE;ICD10-BD;C71;;SAME-AS;;;;;;;
;Malignant neoplasm of cerebrum, except lobes and ventricles;;;;Diagnosis;N/A;;FALSE;ICD10-BD;C71.0;;SAME-AS;;;;;;;
;Malignant neoplasm of frontal lobe;;;;Diagnosis;N/A;;FALSE;ICD10-BD;C71.1;;SAME-AS;;;;;;;
;Malignant neoplasm of temporal lobe;;;;Diagnosis;N/A;;FALSE;ICD10-BD;C71.2;;SAME-AS;;;;;;;
;Malignant neoplasm of parietal lobe;;;;Diagnosis;N/A;;FALSE;ICD10-BD;C71.3;;SAME-AS;;;;;;;
;Malignant neoplasm of occipital lobe;;;;Diagnosis;N/A;;FALSE;ICD10-BD;C71.4;;SAME-AS;;;;;;;
;Malignant neoplasm of cerebral ventricle;;;;Diagnosis;N/A;;FALSE;ICD10-BD;C71.5;;SAME-AS;;;;;;;
;Malignant neoplasm of cerebellum;;;;Diagnosis;N/A;;FALSE;ICD10-BD;C71.6;;SAME-AS;;;;;;;
;Malignant neoplasm of brain stem;;;;Diagnosis;N/A;;FALSE;ICD10-BD;C71.7;;SAME-AS;;;;;;;
;Malignant neoplasm of overlapping lesion of brain;;;;Diagnosis;N/A;;FALSE;ICD10-BD;C71.8;;SAME-AS;;;;;;;
;Malignant neoplasm of brain, unspecified;;;;Diagnosis;N/A;;FALSE;ICD10-BD;C71.9;;SAME-AS;;;;;;;
;Malignant neoplasm of spinal cord, cranial nerves, and other parts of central nervous system;;;;Diagnosis;N/A;;FALSE;ICD10-BD;C72;;SAME-AS;;;;;;;
;Malignant neoplasm of spinal cord;;;;Diagnosis;N/A;;FALSE;ICD10-BD;C72.0;;SAME-AS;;;;;;;
;Malignant neoplasm of cauda equina;;;;Diagnosis;N/A;;FALSE;ICD10-BD;C72.1;;SAME-AS;;;;;;;
;Malignant neoplasm of olfactory nerve;;;;Diagnosis;N/A;;FALSE;ICD10-BD;C72.2;;SAME-AS;;;;;;;
;Malignant neoplasm of optic nerve;;;;Diagnosis;N/A;;FALSE;ICD10-BD;C72.3;;SAME-AS;;;;;;;
;Malignant neoplasm of acoustic nerve;;;;Diagnosis;N/A;;FALSE;ICD10-BD;C72.4;;SAME-AS;;;;;;;
;Malignant neoplasm of other and unspecified cranial nerves;;;;Diagnosis;N/A;;FALSE;ICD10-BD;C72.5;;SAME-AS;;;;;;;
;Malignant neoplasm of overlapping lesion of brain and other parts of central nervous system;;;;Diagnosis;N/A;;FALSE;ICD10-BD;C72.8;;SAME-AS;;;;;;;
;Malignant neoplasm of central nervous system, unspecified;;;;Diagnosis;N/A;;FALSE;ICD10-BD;C72.9;;SAME-AS;;;;;;;
;Malignant neoplasm of thyroid gland;;;;Diagnosis;N/A;;FALSE;ICD10-BD;C73;;SAME-AS;;;;;;;
;Malignant neoplasm of adrenal gland;;;;Diagnosis;N/A;;FALSE;ICD10-BD;C74;;SAME-AS;;;;;;;
;Malignant neoplasm of cortex of adrenal gland;;;;Diagnosis;N/A;;FALSE;ICD10-BD;C74.0;;SAME-AS;;;;;;;
;Malignant neoplasm of medulla of adrenal gland;;;;Diagnosis;N/A;;FALSE;ICD10-BD;C74.1;;SAME-AS;;;;;;;
;Malignant neoplasm of adrenal gland, unspecified;;;;Diagnosis;N/A;;FALSE;ICD10-BD;C74.9;;SAME-AS;;;;;;;
;Malignant neoplasm of other endocrine glands and related structures;;;;Diagnosis;N/A;;FALSE;ICD10-BD;C75;;SAME-AS;;;;;;;
;Malignant neoplasm of parathyroid gland;;;;Diagnosis;N/A;;FALSE;ICD10-BD;C75.0;;SAME-AS;;;;;;;
;Malignant neoplasm of pituitary gland;;;;Diagnosis;N/A;;FALSE;ICD10-BD;C75.1;;SAME-AS;;;;;;;
;Malignant neoplasm of craniopharyngeal duct;;;;Diagnosis;N/A;;FALSE;ICD10-BD;C75.2;;SAME-AS;;;;;;;
;Malignant neoplasm of pineal gland;;;;Diagnosis;N/A;;FALSE;ICD10-BD;C75.3;;SAME-AS;;;;;;;
;Malignant neoplasm of carotid body;;;;Diagnosis;N/A;;FALSE;ICD10-BD;C75.4;;SAME-AS;;;;;;;
;Malignant neoplasm of aortic body and other paraganglia;;;;Diagnosis;N/A;;FALSE;ICD10-BD;C75.5;;SAME-AS;;;;;;;
;Malignant neoplasm of pluriglandular involvement, unspecified;;;;Diagnosis;N/A;;FALSE;ICD10-BD;C75.8;;SAME-AS;;;;;;;
;Malignant neoplasm of endocrine gland, unspecified;;;;Diagnosis;N/A;;FALSE;ICD10-BD;C75.9;;SAME-AS;;;;;;;
;Malignant neoplasm of other and ill-defined sites;;;;Diagnosis;N/A;;FALSE;ICD10-BD;C76;;SAME-AS;;;;;;;
;Malignant neoplasm of head, face, and neck;;;;Diagnosis;N/A;;FALSE;ICD10-BD;C76.0;;SAME-AS;;;;;;;
;Malignant neoplasm of thorax;;;;Diagnosis;N/A;;FALSE;ICD10-BD;C76.1;;SAME-AS;;;;;;;
;Malignant neoplasm of abdomen;;;;Diagnosis;N/A;;FALSE;ICD10-BD;C76.2;;SAME-AS;;;;;;;
;Malignant neoplasm of pelvis;;;;Diagnosis;N/A;;FALSE;ICD10-BD;C76.3;;SAME-AS;;;;;;;
;Malignant neoplasm of upper limb;;;;Diagnosis;N/A;;FALSE;ICD10-BD;C76.4;;SAME-AS;;;;;;;
;Malignant neoplasm of lower limb;;;;Diagnosis;N/A;;FALSE;ICD10-BD;C76.5;;SAME-AS;;;;;;;
;Malignant neoplasm of other ill-defined sites;;;;Diagnosis;N/A;;FALSE;ICD10-BD;C76.7;;SAME-AS;;;;;;;
;Malignant neoplasm of overlapping lesion of other and ill-defined sites;;;;Diagnosis;N/A;;FALSE;ICD10-BD;C76.8;;SAME-AS;;;;;;;
;Secondary and unspecified malignant neoplasm of lymph nodes;;;;Diagnosis;N/A;;FALSE;ICD10-BD;C77;;SAME-AS;;;;;;;
;Malignant neoplasm of lymph nodes of head, face, and neck;;;;Diagnosis;N/A;;FALSE;ICD10-BD;C77.0;;SAME-AS;;;;;;;
;Malignant neoplasm of intrathoracic lymph nodes;;;;Diagnosis;N/A;;FALSE;ICD10-BD;C77.1;;SAME-AS;;;;;;;
;Malignant neoplasm of intra-abdominal lymph nodes;;;;Diagnosis;N/A;;FALSE;ICD10-BD;C77.2;;SAME-AS;;;;;;;
;Malignant neoplasm of axillary and upper limb lymph nodes;;;;Diagnosis;N/A;;FALSE;ICD10-BD;C77.3;;SAME-AS;;;;;;;
;Malignant neoplasm of inguinal and lower limb lymph nodes;;;;Diagnosis;N/A;;FALSE;ICD10-BD;C77.4;;SAME-AS;;;;;;;
;Malignant neoplasm of intrapelvic lymph nodes;;;;Diagnosis;N/A;;FALSE;ICD10-BD;C77.5;;SAME-AS;;;;;;;
;Malignant neoplasm of lymph nodes of multiple regions;;;;Diagnosis;N/A;;FALSE;ICD10-BD;C77.8;;SAME-AS;;;;;;;
;Malignant neoplasm of lymph node, unspecified;;;;Diagnosis;N/A;;FALSE;ICD10-BD;C77.9;;SAME-AS;;;;;;;
;Secondary malignant neoplasm of respiratory and digestive organs;;;;Diagnosis;N/A;;FALSE;ICD10-BD;C78;;SAME-AS;;;;;;;
;Secondary malignant neoplasm of lung;;;;Diagnosis;N/A;;FALSE;ICD10-BD;C78.0;;SAME-AS;;;;;;;
;Secondary malignant neoplasm of mediastinum;;;;Diagnosis;N/A;;FALSE;ICD10-BD;C78.1;;SAME-AS;;;;;;;
;Secondary malignant neoplasm of pleura;;;;Diagnosis;N/A;;FALSE;ICD10-BD;C78.2;;SAME-AS;;;;;;;
;Secondary malignant neoplasm of other and unspecified respiratory organs;;;;Diagnosis;N/A;;FALSE;ICD10-BD;C78.3;;SAME-AS;;;;;;;
;Secondary malignant neoplasm of small intestine;;;;Diagnosis;N/A;;FALSE;ICD10-BD;C78.4;;SAME-AS;;;;;;;
;Secondary malignant neoplasm of large intestine and rectum;;;;Diagnosis;N/A;;FALSE;ICD10-BD;C78.5;;SAME-AS;;;;;;;
;Secondary malignant neoplasm of retroperitoneum and peritoneum;;;;Diagnosis;N/A;;FALSE;ICD10-BD;C78.6;;SAME-AS;;;;;;;
;Secondary malignant neoplasm of liver;;;;Diagnosis;N/A;;FALSE;ICD10-BD;C78.7;;SAME-AS;;;;;;;
;Secondary malignant neoplasm of other and unspecified digestive organs;;;;Diagnosis;N/A;;FALSE;ICD10-BD;C78.8;;SAME-AS;;;;;;;
;Secondary malignant neoplasm of other sites;;;;Diagnosis;N/A;;FALSE;ICD10-BD;C79;;SAME-AS;;;;;;;
;Secondary malignant neoplasm of kidney and renal pelvis;;;;Diagnosis;N/A;;FALSE;ICD10-BD;C79.0;;SAME-AS;;;;;;;
;Secondary malignant neoplasm of bladder and other and unspecified urinary organs;;;;Diagnosis;N/A;;FALSE;ICD10-BD;C79.1;;SAME-AS;;;;;;;
;Secondary malignant neoplasm of skin;;;;Diagnosis;N/A;;FALSE;ICD10-BD;C79.2;;SAME-AS;;;;;;;
;Secondary malignant neoplasm of brain and cerebral meninges;;;;Diagnosis;N/A;;FALSE;ICD10-BD;C79.3;;SAME-AS;;;;;;;
;Secondary malignant neoplasm of other and unspecified parts of nervous system;;;;Diagnosis;N/A;;FALSE;ICD10-BD;C79.4;;SAME-AS;;;;;;;
;Secondary malignant neoplasm of bone and bone marrow;;;;Diagnosis;N/A;;FALSE;ICD10-BD;C79.5;;SAME-AS;;;;;;;
;Secondary malignant neoplasm of ovary;;;;Diagnosis;N/A;;FALSE;ICD10-BD;C79.6;;SAME-AS;;;;;;;
;Secondary malignant neoplasm of adrenal gland;;;;Diagnosis;N/A;;FALSE;ICD10-BD;C79.7;;SAME-AS;;;;;;;
;Secondary malignant neoplasm of other specified sites;;;;Diagnosis;N/A;;FALSE;ICD10-BD;C79.8;;SAME-AS;;;;;;;
;Malignant neoplasm without specification of site;;;;Diagnosis;N/A;;FALSE;ICD10-BD;C80;;SAME-AS;;;;;;;
;Hodgkin's disease;;;;Diagnosis;N/A;;FALSE;ICD10-BD;C81;;SAME-AS;;;;;;;
;Hodgkin's lymphocytic predominance;;;;Diagnosis;N/A;;FALSE;ICD10-BD;C81.0;;SAME-AS;;;;;;;
;Hodgkin's nodular sclerosis;;;;Diagnosis;N/A;;FALSE;ICD10-BD;C81.1;;SAME-AS;;;;;;;
;Hodgkin's mixed cellularity;;;;Diagnosis;N/A;;FALSE;ICD10-BD;C81.2;;SAME-AS;;;;;;;
;Hodgkin's lymphocytic depletion;;;;Diagnosis;N/A;;FALSE;ICD10-BD;C81.3;;SAME-AS;;;;;;;
;Other Hodgkin's disease;;;;Diagnosis;N/A;;FALSE;ICD10-BD;C81.7;;SAME-AS;;;;;;;
;Hodgkin's disease, unspecified;;;;Diagnosis;N/A;;FALSE;ICD10-BD;C81.9;;SAME-AS;;;;;;;
;Follicular [nodular] non-Hodgkin's lymphoma;;;;Diagnosis;N/A;;FALSE;ICD10-BD;C82;;SAME-AS;;;;;;;
;Non-Hodgkin's lymphoma small cleaved cell, follicular;;;;Diagnosis;N/A;;FALSE;ICD10-BD;C82.0;;SAME-AS;;;;;;;
;Non-Hodgkin's lymphoma mixed small cleaved and large cell, follicular;;;;Diagnosis;N/A;;FALSE;ICD10-BD;C82.1;;SAME-AS;;;;;;;
;Non-Hodgkin's lymphoma large cell, follicular;;;;Diagnosis;N/A;;FALSE;ICD10-BD;C82.2;;SAME-AS;;;;;;;
;Other types of follicular non-Hodgkin's lymphoma;;;;Diagnosis;N/A;;FALSE;ICD10-BD;C82.7;;SAME-AS;;;;;;;
;Follicular non-Hodgkin's lymphoma, unspecified;;;;Diagnosis;N/A;;FALSE;ICD10-BD;C82.9;;SAME-AS;;;;;;;
;Diffuse non-Hodgkin's lymphoma;;;;Diagnosis;N/A;;FALSE;ICD10-BD;C83;;SAME-AS;;;;;;;
;Non-Hodgkin's lymphoma small cell (diffuse);;;;Diagnosis;N/A;;FALSE;ICD10-BD;C83.0;;SAME-AS;;;;;;;
;Non-Hodgkin's lymphoma small cleaved cell (diffuse);;;;Diagnosis;N/A;;FALSE;ICD10-BD;C83.1;;SAME-AS;;;;;;;
;Non-Hodgkin's lymphoma mixed small and large cell (diffuse);;;;Diagnosis;N/A;;FALSE;ICD10-BD;C83.2;;SAME-AS;;;;;;;
;Non-Hodgkin's lymphoma large cell (diffuse);;;;Diagnosis;N/A;;FALSE;ICD10-BD;C83.3;;SAME-AS;;;;;;;
;Non-Hodgkin's lymphoma immunoblastic (diffuse);;;;Diagnosis;N/A;;FALSE;ICD10-BD;C83.4;;SAME-AS;;;;;;;
;Non-Hodgkin's lymphoma lymphoblastic (diffuse);;;;Diagnosis;N/A;;FALSE;ICD10-BD;C83.5;;SAME-AS;;;;;;;
;Non-Hodgkin's lymphoma undifferentiated (diffuse);;;;Diagnosis;N/A;;FALSE;ICD10-BD;C83.6;;SAME-AS;;;;;;;
;Burkitt's tumor;;;;Diagnosis;N/A;;FALSE;ICD10-BD;C83.7;;SAME-AS;;;;;;;
;Other types of diffuse non-Hodgkin's lymphoma;;;;Diagnosis;N/A;;FALSE;ICD10-BD;C83.8;;SAME-AS;;;;;;;
;Diffuse non-Hodgkin's lymphoma, unspecified;;;;Diagnosis;N/A;;FALSE;ICD10-BD;C83.9;;SAME-AS;;;;;;;
;Peripheral and cutaneous T-cell lymphomas;;;;Diagnosis;N/A;;FALSE;ICD10-BD;C84;;SAME-AS;;;;;;;
;Mycosis fungoides;;;;Diagnosis;N/A;;FALSE;ICD10-BD;C84.0;;SAME-AS;;;;;;;
;Sézary's disease;;;;Diagnosis;N/A;;FALSE;ICD10-BD;C84.1;;SAME-AS;;;;;;;
;T-zone lymphoma;;;;Diagnosis;N/A;;FALSE;ICD10-BD;C84.2;;SAME-AS;;;;;;;
;Lymphoepithelioid lymphoma;;;;Diagnosis;N/A;;FALSE;ICD10-BD;C84.3;;SAME-AS;;;;;;;
;Peripheral T-cell lymphoma;;;;Diagnosis;N/A;;FALSE;ICD10-BD;C84.4;;SAME-AS;;;;;;;
;Other and unspecified T-cell lymphomas;;;;Diagnosis;N/A;;FALSE;ICD10-BD;C84.5;;SAME-AS;;;;;;;
;Other and unspecified types of non-Hodgkin's lymphoma;;;;Diagnosis;N/A;;FALSE;ICD10-BD;C85;;SAME-AS;;;;;;;
;Lymphosarcoma;;;;Diagnosis;N/A;;FALSE;ICD10-BD;C85.0;;SAME-AS;;;;;;;
;B-cell lymphoma, unspecified;;;;Diagnosis;N/A;;FALSE;ICD10-BD;C85.1;;SAME-AS;;;;;;;
;Other specified types of non-Hodgkin's lymphoma;;;;Diagnosis;N/A;;FALSE;ICD10-BD;C85.7;;SAME-AS;;;;;;;
;Non-Hodgkin's lymphoma, unspecified type;;;;Diagnosis;N/A;;FALSE;ICD10-BD;C85.9;;SAME-AS;;;;;;;
;Malignant immunoproliferative diseases;;;;Diagnosis;N/A;;FALSE;ICD10-BD;C88;;SAME-AS;;;;;;;
;Waldenström's macroglobulinemia;;;;Diagnosis;N/A;;FALSE;ICD10-BD;C88.0;;SAME-AS;;;;;;;
;Alpha heavy chain disease;;;;Diagnosis;N/A;;FALSE;ICD10-BD;C88.1;;SAME-AS;;;;;;;
;Gamma heavy chain disease;;;;Diagnosis;N/A;;FALSE;ICD10-BD;C88.2;;SAME-AS;;;;;;;
;Immunoproliferative small intestinal disease;;;;Diagnosis;N/A;;FALSE;ICD10-BD;C88.3;;SAME-AS;;;;;;;
;Other malignant immunoproliferative diseases;;;;Diagnosis;N/A;;FALSE;ICD10-BD;C88.7;;SAME-AS;;;;;;;
;Malignant immunoproliferative disease, unspecified;;;;Diagnosis;N/A;;FALSE;ICD10-BD;C88.9;;SAME-AS;;;;;;;
;Multiple myeloma and malignant plasma cell neoplasms;;;;Diagnosis;N/A;;FALSE;ICD10-BD;C90;;SAME-AS;;;;;;;
;Multiple myeloma;;;;Diagnosis;N/A;;FALSE;ICD10-BD;C90.0;;SAME-AS;;;;;;;
;Plasma cell leukemia;;;;Diagnosis;N/A;;FALSE;ICD10-BD;C90.1;;SAME-AS;;;;;;;
;Plasmacytoma, extramedullary;;;;Diagnosis;N/A;;FALSE;ICD10-BD;C90.2;;SAME-AS;;;;;;;
;Lymphoid leukemia;;;;Diagnosis;N/A;;FALSE;ICD10-BD;C91;;SAME-AS;;;;;;;
;Acute lymphoblastic leukemia;;;;Diagnosis;N/A;;FALSE;ICD10-BD;C91.0;;SAME-AS;;;;;;;
;Chronic lymphocytic leukemia;;;;Diagnosis;N/A;;FALSE;ICD10-BD;C91.1;;SAME-AS;;;;;;;
;Subacute lymphocytic leukemia;;;;Diagnosis;N/A;;FALSE;ICD10-BD;C91.2;;SAME-AS;;;;;;;
;Prolymphocytic leukemia;;;;Diagnosis;N/A;;FALSE;ICD10-BD;C91.3;;SAME-AS;;;;;;;
;Hairy-cell leukemia;;;;Diagnosis;N/A;;FALSE;ICD10-BD;C91.4;;SAME-AS;;;;;;;
;Adult T-cell leukemia;;;;Diagnosis;N/A;;FALSE;ICD10-BD;C91.5;;SAME-AS;;;;;;;
;Other lymphoid leukemia;;;;Diagnosis;N/A;;FALSE;ICD10-BD;C91.7;;SAME-AS;;;;;;;
;Lymphoid leukemia, unspecified;;;;Diagnosis;N/A;;FALSE;ICD10-BD;C91.9;;SAME-AS;;;;;;;
;Myeloid leukemia;;;;Diagnosis;N/A;;FALSE;ICD10-BD;C92;;SAME-AS;;;;;;;
;Acute myeloid leukemia;;;;Diagnosis;N/A;;FALSE;ICD10-BD;C92.0;;SAME-AS;;;;;;;
;Chronic myeloid leukemia;;;;Diagnosis;N/A;;FALSE;ICD10-BD;C92.1;;SAME-AS;;;;;;;
;Subacute myeloid leukemia;;;;Diagnosis;N/A;;FALSE;ICD10-BD;C92.2;;SAME-AS;;;;;;;
;Myeloid sarcoma;;;;Diagnosis;N/A;;FALSE;ICD10-BD;C92.3;;SAME-AS;;;;;;;
;Acute promyelocytic leukemia;;;;Diagnosis;N/A;;FALSE;ICD10-BD;C92.4;;SAME-AS;;;;;;;
;Acute myelomonocytic leukemia;;;;Diagnosis;N/A;;FALSE;ICD10-BD;C92.5;;SAME-AS;;;;;;;
;Other myeloid leukemia;;;;Diagnosis;N/A;;FALSE;ICD10-BD;C92.7;;SAME-AS;;;;;;;
;Myeloid leukemia, unspecified;;;;Diagnosis;N/A;;FALSE;ICD10-BD;C92.9;;SAME-AS;;;;;;;
;Monocytic leukemia;;;;Diagnosis;N/A;;FALSE;ICD10-BD;C93;;SAME-AS;;;;;;;
;Acute monocytic leukemia;;;;Diagnosis;N/A;;FALSE;ICD10-BD;C93.0;;SAME-AS;;;;;;;
;Chronic monocytic leukemia;;;;Diagnosis;N/A;;FALSE;ICD10-BD;C93.1;;SAME-AS;;;;;;;
;Subacute monocytic leukemia;;;;Diagnosis;N/A;;FALSE;ICD10-BD;C93.2;;SAME-AS;;;;;;;
;Other monocytic leukemia;;;;Diagnosis;N/A;;FALSE;ICD10-BD;C93.7;;SAME-AS;;;;;;;
;Monocytic leukemia, unspecified;;;;Diagnosis;N/A;;FALSE;ICD10-BD;C93.9;;SAME-AS;;;;;;;
;Other leukemias of specified cell type;;;;Diagnosis;N/A;;FALSE;ICD10-BD;C94;;SAME-AS;;;;;;;
;Acute erythremia and erythroleukemia;;;;Diagnosis;N/A;;FALSE;ICD10-BD;C94.0;;SAME-AS;;;;;;;
;Chronic erythremia;;;;Diagnosis;N/A;;FALSE;ICD10-BD;C94.1;;SAME-AS;;;;;;;
;Acute megakaryoblastic leukemia;;;;Diagnosis;N/A;;FALSE;ICD10-BD;C94.2;;SAME-AS;;;;;;;
;Mast cell leukemia;;;;Diagnosis;N/A;;FALSE;ICD10-BD;C94.3;;SAME-AS;;;;;;;
;Acute panmyelosis;;;;Diagnosis;N/A;;FALSE;ICD10-BD;C94.4;;SAME-AS;;;;;;;
;Acute myelofibrosis;;;;Diagnosis;N/A;;FALSE;ICD10-BD;C94.5;;SAME-AS;;;;;;;
;Other specified leukemias;;;;Diagnosis;N/A;;FALSE;ICD10-BD;C94.7;;SAME-AS;;;;;;;
;Leukemia of unspecified cell type;;;;Diagnosis;N/A;;FALSE;ICD10-BD;C95;;SAME-AS;;;;;;;
;Acute leukemia of unspecified cell type;;;;Diagnosis;N/A;;FALSE;ICD10-BD;C95.0;;SAME-AS;;;;;;;
;Chronic leukemia of unspecified cell type;;;;Diagnosis;N/A;;FALSE;ICD10-BD;C95.1;;SAME-AS;;;;;;;
;Subacute leukemia of unspecified cell type;;;;Diagnosis;N/A;;FALSE;ICD10-BD;C95.2;;SAME-AS;;;;;;;
;Other leukemia of unspecified cell type;;;;Diagnosis;N/A;;FALSE;ICD10-BD;C95.7;;SAME-AS;;;;;;;
;Leukemia, unspecified;;;;Diagnosis;N/A;;FALSE;ICD10-BD;C95.9;;SAME-AS;;;;;;;
;Other and unspecified malignant neoplasms of lymphoid, hematopoietic, and related tissue;;;;Diagnosis;N/A;;FALSE;ICD10-BD;C96;;SAME-AS;;;;;;;
