uuid;name;description;local-name;local-description;class;datatype;shortname;is-set;reference-term-source;reference-term-code;reference-term-name;reference-term-relationship;units;high-normal;low-normal;member-of;member-of-sort-weight;answer-of;answer-of-sort-weight
;Letterer-Siwe disease;;;;Diagnosis;N/A;;FALSE;ICD10-BD;C96.0;;SAME-AS;;;;;;;
;Malignant histiocytosis;;;;Diagnosis;N/A;;FALSE;ICD10-BD;C96.1;;SAME-AS;;;;;;;
;Malignant mast cell tumor;;;;Diagnosis;N/A;;FALSE;ICD10-BD;C96.2;;SAME-AS;;;;;;;
;True histiocytic lymphoma;;;;Diagnosis;N/A;;FALSE;ICD10-BD;C96.3;;SAME-AS;;;;;;;
;Other specified malignant neoplasms of lymphoid, hematopoietic, and related tissue;;;;Diagnosis;N/A;;FALSE;ICD10-BD;C96.7;;SAME-AS;;;;;;;
;Malignant neoplasms of lymphoid, hematopoietic, and related tissue, unspecified;;;;Diagnosis;N/A;;FALSE;ICD10-BD;C96.9;;SAME-AS;;;;;;;
;Malignant neoplasms of independent (primary) multiple sites;;;;Diagnosis;N/A;;FALSE;ICD10-BD;C97;;SAME-AS;;;;;;;
;Malignant neoplasms of independent (primary) multiple sites;;;;Diagnosis;N/A;;FALSE;ICD10-BD;C97;;SAME-AS;;;;;;;
;Carcinoma in situ of oral cavity, esophagus, and stomach;;;;Diagnosis;N/A;;FALSE;ICD10-BD;D00;;SAME-AS;;;;;;;
;Carcinoma in situ of lip, oral cavity, and pharynx;;;;Diagnosis;N/A;;FALSE;ICD10-BD;D00.0;;SAME-AS;;;;;;;
;Carcinoma in situ of esophagus;;;;Diagnosis;N/A;;FALSE;ICD10-BD;D00.1;;SAME-AS;;;;;;;
;Carcinoma in situ of stomach;;;;Diagnosis;N/A;;FALSE;ICD10-BD;D00.2;;SAME-AS;;;;;;;
;Carcinoma in situ of other and unspecified digestive organs;;;;Diagnosis;N/A;;FALSE;ICD10-BD;D01;;SAME-AS;;;;;;;
;Carcinoma in situ of colon;;;;Diagnosis;N/A;;FALSE;ICD10-BD;D01.0;;SAME-AS;;;;;;;
;Carcinoma in situ of rectosigmoid junction;;;;Diagnosis;N/A;;FALSE;ICD10-BD;D01.1;;SAME-AS;;;;;;;
;Carcinoma in situ of rectum;;;;Diagnosis;N/A;;FALSE;ICD10-BD;D01.2;;SAME-AS;;;;;;;
;Carcinoma in situ of anus and anal canal;;;;Diagnosis;N/A;;FALSE;ICD10-BD;D01.3;;SAME-AS;;;;;;;
;Carcinoma in situ of other and unspecified parts of intestine;;;;Diagnosis;N/A;;FALSE;ICD10-BD;D01.4;;SAME-AS;;;;;;;
;Carcinoma in situ of liver, gallbladder, and bile ducts;;;;Diagnosis;N/A;;FALSE;ICD10-BD;D01.5;;SAME-AS;;;;;;;
;Carcinoma in situ of other specified digestive organs;;;;Diagnosis;N/A;;FALSE;ICD10-BD;D01.7;;SAME-AS;;;;;;;
;Carcinoma in situ of digestive organ, unspecified;;;;Diagnosis;N/A;;FALSE;ICD10-BD;D01.9;;SAME-AS;;;;;;;
;Carcinoma in situ of middle ear and respiratory system;;;;Diagnosis;N/A;;FALSE;ICD10-BD;D02;;SAME-AS;;;;;;;
;Carcinoma in situ of larynx;;;;Diagnosis;N/A;;FALSE;ICD10-BD;D02.0;;SAME-AS;;;;;;;
;Carcinoma in situ of trachea;;;;Diagnosis;N/A;;FALSE;ICD10-BD;D02.1;;SAME-AS;;;;;;;
;Carcinoma in situ of bronchus and lung;;;;Diagnosis;N/A;;FALSE;ICD10-BD;D02.2;;SAME-AS;;;;;;;
;Carcinoma in situ of other parts of respiratory system;;;;Diagnosis;N/A;;FALSE;ICD10-BD;D02.3;;SAME-AS;;;;;;;
;Carcinoma in situ of respiratory system, unspecified;;;;Diagnosis;N/A;;FALSE;ICD10-BD;D02.4;;SAME-AS;;;;;;;
;Melanoma in situ;;;;Diagnosis;N/A;;FALSE;ICD10-BD;D03;;SAME-AS;;;;;;;
;Melanoma in situ of lip;;;;Diagnosis;N/A;;FALSE;ICD10-BD;D03.0;;SAME-AS;;;;;;;
;Melanoma in situ of eyelid, including canthus;;;;Diagnosis;N/A;;FALSE;ICD10-BD;D03.1;;SAME-AS;;;;;;;
;Melanoma in situ of ear and external auricular canal;;;;Diagnosis;N/A;;FALSE;ICD10-BD;D03.2;;SAME-AS;;;;;;;
;Melanoma in situ of other and unspecified parts of face;;;;Diagnosis;N/A;;FALSE;ICD10-BD;D03.3;;SAME-AS;;;;;;;
;Melanoma in situ of scalp and neck;;;;Diagnosis;N/A;;FALSE;ICD10-BD;D03.4;;SAME-AS;;;;;;;
;Melanoma in situ of trunk;;;;Diagnosis;N/A;;FALSE;ICD10-BD;D03.5;;SAME-AS;;;;;;;
;Melanoma in situ of upper limb, including shoulder;;;;Diagnosis;N/A;;FALSE;ICD10-BD;D03.6;;SAME-AS;;;;;;;
;Melanoma in situ of lower limb, including hip;;;;Diagnosis;N/A;;FALSE;ICD10-BD;D03.7;;SAME-AS;;;;;;;
;Melanoma in situ of other sites;;;;Diagnosis;N/A;;FALSE;ICD10-BD;D03.8;;SAME-AS;;;;;;;
;Melanoma in situ, unspecified;;;;Diagnosis;N/A;;FALSE;ICD10-BD;D03.9;;SAME-AS;;;;;;;
;Carcinoma in situ of skin;;;;Diagnosis;N/A;;FALSE;ICD10-BD;D04;;SAME-AS;;;;;;;
;Carcinoma in situ of skin of lip;;;;Diagnosis;N/A;;FALSE;ICD10-BD;D04.0;;SAME-AS;;;;;;;
;Carcinoma in situ of skin of eyelid, including canthus;;;;Diagnosis;N/A;;FALSE;ICD10-BD;D04.1;;SAME-AS;;;;;;;
;Carcinoma in situ of skin of ear and external auricular canal;;;;Diagnosis;N/A;;FALSE;ICD10-BD;D04.2;;SAME-AS;;;;;;;
;Carcinoma in situ of skin of other and unspecified parts of face;;;;Diagnosis;N/A;;FALSE;ICD10-BD;D04.3;;SAME-AS;;;;;;;
;Carcinoma in situ of skin of scalp and neck;;;;Diagnosis;N/A;;FALSE;ICD10-BD;D04.4;;SAME-AS;;;;;;;
;Carcinoma in situ of skin of trunk;;;;Diagnosis;N/A;;FALSE;ICD10-BD;D04.5;;SAME-AS;;;;;;;
;Carcinoma in situ of skin of upper limb, including shoulder;;;;Diagnosis;N/A;;FALSE;ICD10-BD;D04.6;;SAME-AS;;;;;;;
;Carcinoma in situ of skin of lower limb, including hip;;;;Diagnosis;N/A;;FALSE;ICD10-BD;D04.7;;SAME-AS;;;;;;;
;Carcinoma in situ of skin of other sites;;;;Diagnosis;N/A;;FALSE;ICD10-BD;D04.8;;SAME-AS;;;;;;;
;Carcinoma in situ of skin, unspecified;;;;Diagnosis;N/A;;FALSE;ICD10-BD;D04.9;;SAME-AS;;;;;;;
;Carcinoma in situ of breast;;;;Diagnosis;N/A;;FALSE;ICD10-BD;D05;;SAME-AS;;;;;;;
;Lobular carcinoma in situ;;;;Diagnosis;N/A;;FALSE;ICD10-BD;D05.0;;SAME-AS;;;;;;;
;Intraductal carcinoma in situ;;;;Diagnosis;N/A;;FALSE;ICD10-BD;D05.1;;SAME-AS;;;;;;;
;Other carcinoma in situ of breast;;;;Diagnosis;N/A;;FALSE;ICD10-BD;D05.7;;SAME-AS;;;;;;;
;Carcinoma in situ of breast, unspecified;;;;Diagnosis;N/A;;FALSE;ICD10-BD;D05.9;;SAME-AS;;;;;;;
;Carcinoma in situ of cervix uteri;;;;Diagnosis;N/A;;FALSE;ICD10-BD;D06;;SAME-AS;;;;;;;
;Carcinoma in situ of endocervix;;;;Diagnosis;N/A;;FALSE;ICD10-BD;D06.0;;SAME-AS;;;;;;;
;Carcinoma in situ of exocervix;;;;Diagnosis;N/A;;FALSE;ICD10-BD;D06.1;;SAME-AS;;;;;;;
;Carcinoma in situ of other parts of cervix;;;;Diagnosis;N/A;;FALSE;ICD10-BD;D06.7;;SAME-AS;;;;;;;
;Carcinoma in situ of cervix, unspecified;;;;Diagnosis;N/A;;FALSE;ICD10-BD;D06.9;;SAME-AS;;;;;;;
;Carcinoma in situ of other and unspecified genital organs;;;;Diagnosis;N/A;;FALSE;ICD10-BD;D07;;SAME-AS;;;;;;;
;Carcinoma in situ of endometrium;;;;Diagnosis;N/A;;FALSE;ICD10-BD;D07.0;;SAME-AS;;;;;;;
;Carcinoma in situ of vulva;;;;Diagnosis;N/A;;FALSE;ICD10-BD;D07.1;;SAME-AS;;;;;;;
;Carcinoma in situ of vagina;;;;Diagnosis;N/A;;FALSE;ICD10-BD;D07.2;;SAME-AS;;;;;;;
;Carcinoma in situ of other and unspecified female genital organs;;;;Diagnosis;N/A;;FALSE;ICD10-BD;D07.3;;SAME-AS;;;;;;;
;Carcinoma in situ of penis;;;;Diagnosis;N/A;;FALSE;ICD10-BD;D07.4;;SAME-AS;;;;;;;
;Carcinoma in situ of prostate;;;;Diagnosis;N/A;;FALSE;ICD10-BD;D07.5;;SAME-AS;;;;;;;
;Carcinoma in situ of other and unspecified male genital organs;;;;Diagnosis;N/A;;FALSE;ICD10-BD;D07.6;;SAME-AS;;;;;;;
;Carcinoma in situ of other and unspecified sites;;;;Diagnosis;N/A;;FALSE;ICD10-BD;D09;;SAME-AS;;;;;;;
;Carcinoma in situ of bladder;;;;Diagnosis;N/A;;FALSE;ICD10-BD;D09.0;;SAME-AS;;;;;;;
;Carcinoma in situ of other and unspecified urinary organs;;;;Diagnosis;N/A;;FALSE;ICD10-BD;D09.1;;SAME-AS;;;;;;;
;Carcinoma in situ of eye;;;;Diagnosis;N/A;;FALSE;ICD10-BD;D09.2;;SAME-AS;;;;;;;
;Carcinoma in situ of thyroid and other endocrine glands;;;;Diagnosis;N/A;;FALSE;ICD10-BD;D09.3;;SAME-AS;;;;;;;
;Carcinoma in situ of other specified sites;;;;Diagnosis;N/A;;FALSE;ICD10-BD;D09.7;;SAME-AS;;;;;;;
;Carcinoma in situ, unspecified;;;;Diagnosis;N/A;;FALSE;ICD10-BD;D09.9;;SAME-AS;;;;;;;
;Benign neoplasm of mouth and pharynx;;;;Diagnosis;N/A;;FALSE;ICD10-BD;D10;;SAME-AS;;;;;;;
;Benign neoplasm of lip;;;;Diagnosis;N/A;;FALSE;ICD10-BD;D10.0;;SAME-AS;;;;;;;
;Benign neoplasm of tongue;;;;Diagnosis;N/A;;FALSE;ICD10-BD;D10.1;;SAME-AS;;;;;;;
;Benign neoplasm of floor of mouth;;;;Diagnosis;N/A;;FALSE;ICD10-BD;D10.2;;SAME-AS;;;;;;;
;Benign neoplasm of other and unspecified parts of mouth;;;;Diagnosis;N/A;;FALSE;ICD10-BD;D10.3;;SAME-AS;;;;;;;
;Benign neoplasm of tonsil;;;;Diagnosis;N/A;;FALSE;ICD10-BD;D10.4;;SAME-AS;;;;;;;
;Benign neoplasm of other parts of oropharynx;;;;Diagnosis;N/A;;FALSE;ICD10-BD;D10.5;;SAME-AS;;;;;;;
;Benign neoplasm of nasopharynx;;;;Diagnosis;N/A;;FALSE;ICD10-BD;D10.6;;SAME-AS;;;;;;;
;Benign neoplasm of hypopharynx;;;;Diagnosis;N/A;;FALSE;ICD10-BD;D10.7;;SAME-AS;;;;;;;
;Benign neoplasm of pharynx, unspecified;;;;Diagnosis;N/A;;FALSE;ICD10-BD;D10.9;;SAME-AS;;;;;;;
;Benign neoplasm of major salivary glands;;;;Diagnosis;N/A;;FALSE;ICD10-BD;D11;;SAME-AS;;;;;;;
;Benign neoplasm of parotid gland;;;;Diagnosis;N/A;;FALSE;ICD10-BD;D11.0;;SAME-AS;;;;;;;
;Benign neoplasm of other major salivary glands;;;;Diagnosis;N/A;;FALSE;ICD10-BD;D11.7;;SAME-AS;;;;;;;
;Benign neoplasm of major salivary gland, unspecified;;;;Diagnosis;N/A;;FALSE;ICD10-BD;D11.9;;SAME-AS;;;;;;;
;Benign neoplasm of colon, rectum, anus, and anal canal;;;;Diagnosis;N/A;;FALSE;ICD10-BD;D12;;SAME-AS;;;;;;;
;Benign neoplasm of cecum;;;;Diagnosis;N/A;;FALSE;ICD10-BD;D12.0;;SAME-AS;;;;;;;
;Benign neoplasm of appendix;;;;Diagnosis;N/A;;FALSE;ICD10-BD;D12.1;;SAME-AS;;;;;;;
;Benign neoplasm of ascending colon;;;;Diagnosis;N/A;;FALSE;ICD10-BD;D12.2;;SAME-AS;;;;;;;
;Benign neoplasm of transverse colon;;;;Diagnosis;N/A;;FALSE;ICD10-BD;D12.3;;SAME-AS;;;;;;;
;Benign neoplasm of descending colon;;;;Diagnosis;N/A;;FALSE;ICD10-BD;D12.4;;SAME-AS;;;;;;;
;Benign neoplasm of sigmoid colon;;;;Diagnosis;N/A;;FALSE;ICD10-BD;D12.5;;SAME-AS;;;;;;;
;Benign neoplasm of colon, unspecified;;;;Diagnosis;N/A;;FALSE;ICD10-BD;D12.6;;SAME-AS;;;;;;;
;Benign neoplasm of rectosigmoid junction;;;;Diagnosis;N/A;;FALSE;ICD10-BD;D12.7;;SAME-AS;;;;;;;
;Benign neoplasm of rectum;;;;Diagnosis;N/A;;FALSE;ICD10-BD;D12.8;;SAME-AS;;;;;;;
;Benign neoplasm of anus and anal canal;;;;Diagnosis;N/A;;FALSE;ICD10-BD;D12.9;;SAME-AS;;;;;;;
;Benign neoplasm of other and ill-defined parts of digestive system;;;;Diagnosis;N/A;;FALSE;ICD10-BD;D13;;SAME-AS;;;;;;;
;Benign neoplasm of esophagus;;;;Diagnosis;N/A;;FALSE;ICD10-BD;D13.0;;SAME-AS;;;;;;;
;Benign neoplasm of stomach;;;;Diagnosis;N/A;;FALSE;ICD10-BD;D13.1;;SAME-AS;;;;;;;
;Benign neoplasm of duodenum;;;;Diagnosis;N/A;;FALSE;ICD10-BD;D13.2;;SAME-AS;;;;;;;
;Benign neoplasm of other and unspecified parts of small intestine;;;;Diagnosis;N/A;;FALSE;ICD10-BD;D13.3;;SAME-AS;;;;;;;
;Benign neoplasm of liver;;;;Diagnosis;N/A;;FALSE;ICD10-BD;D13.4;;SAME-AS;;;;;;;
;Benign neoplasm of extrahepatic bile ducts;;;;Diagnosis;N/A;;FALSE;ICD10-BD;D13.5;;SAME-AS;;;;;;;
;Benign neoplasm of pancreas;;;;Diagnosis;N/A;;FALSE;ICD10-BD;D13.6;;SAME-AS;;;;;;;
;Benign neoplasm of endocrine pancreas;;;;Diagnosis;N/A;;FALSE;ICD10-BD;D13.7;;SAME-AS;;;;;;;
;Benign neoplasm of ill-defined sites within the digestive system;;;;Diagnosis;N/A;;FALSE;ICD10-BD;D13.9;;SAME-AS;;;;;;;
;Benign neoplasm of middle ear and respiratory system;;;;Diagnosis;N/A;;FALSE;ICD10-BD;D14;;SAME-AS;;;;;;;
;Benign neoplasm of middle ear, nasal cavity, and accessory sinuses;;;;Diagnosis;N/A;;FALSE;ICD10-BD;D14.0;;SAME-AS;;;;;;;
;Benign neoplasm of larynx;;;;Diagnosis;N/A;;FALSE;ICD10-BD;D14.1;;SAME-AS;;;;;;;
;Benign neoplasm of trachea;;;;Diagnosis;N/A;;FALSE;ICD10-BD;D14.2;;SAME-AS;;;;;;;
;Benign neoplasm of bronchus and lung;;;;Diagnosis;N/A;;FALSE;ICD10-BD;D14.3;;SAME-AS;;;;;;;
;Benign neoplasm of respiratory system, unspecified;;;;Diagnosis;N/A;;FALSE;ICD10-BD;D14.4;;SAME-AS;;;;;;;
;Benign neoplasm of other and unspecified intrathoracic organs;;;;Diagnosis;N/A;;FALSE;ICD10-BD;D15;;SAME-AS;;;;;;;
;Benign neoplasm of thymus;;;;Diagnosis;N/A;;FALSE;ICD10-BD;D15.0;;SAME-AS;;;;;;;
;Benign neoplasm of heart;;;;Diagnosis;N/A;;FALSE;ICD10-BD;D15.1;;SAME-AS;;;;;;;
;Benign neoplasm of mediastinum;;;;Diagnosis;N/A;;FALSE;ICD10-BD;D15.2;;SAME-AS;;;;;;;
;Benign neoplasm of other specified intrathoracic organs;;;;Diagnosis;N/A;;FALSE;ICD10-BD;D15.7;;SAME-AS;;;;;;;
;Benign neoplasm of intrathoracic organ, unspecified;;;;Diagnosis;N/A;;FALSE;ICD10-BD;D15.9;;SAME-AS;;;;;;;
;Benign neoplasm of bone and articular cartilage;;;;Diagnosis;N/A;;FALSE;ICD10-BD;D16;;SAME-AS;;;;;;;
;Benign neoplasm of scapula and long bones of upper limb;;;;Diagnosis;N/A;;FALSE;ICD10-BD;D16.0;;SAME-AS;;;;;;;
;Benign neoplasm of short bones of upper limb;;;;Diagnosis;N/A;;FALSE;ICD10-BD;D16.1;;SAME-AS;;;;;;;
;Benign neoplasm of long bones of lower limb;;;;Diagnosis;N/A;;FALSE;ICD10-BD;D16.2;;SAME-AS;;;;;;;
;Benign neoplasm of short bones of lower limb;;;;Diagnosis;N/A;;FALSE;ICD10-BD;D16.3;;SAME-AS;;;;;;;
;Benign neoplasm of bones of skull and face;;;;Diagnosis;N/A;;FALSE;ICD10-BD;D16.4;;SAME-AS;;;;;;;
;Benign neoplasm of lower jaw bone;;;;Diagnosis;N/A;;FALSE;ICD10-BD;D16.5;;SAME-AS;;;;;;;
;Benign neoplasm of vertebral column;;;;Diagnosis;N/A;;FALSE;ICD10-BD;D16.6;;SAME-AS;;;;;;;
;Benign neoplasm of ribs, sternum, and clavicle;;;;Diagnosis;N/A;;FALSE;ICD10-BD;D16.7;;SAME-AS;;;;;;;
;Benign neoplasm of pelvic bones, sacrum, and coccyx;;;;Diagnosis;N/A;;FALSE;ICD10-BD;D16.8;;SAME-AS;;;;;;;
;Benign neoplasm of bone and articular cartilage, unspecified;;;;Diagnosis;N/A;;FALSE;ICD10-BD;D16.9;;SAME-AS;;;;;;;
;Benign lipomatous neoplasm;;;;Diagnosis;N/A;;FALSE;ICD10-BD;D17;;SAME-AS;;;;;;;
;Benign lipomatous neoplasm of skin and subcutaneous tissue of head, face, and neck;;;;Diagnosis;N/A;;FALSE;ICD10-BD;D17.0;;SAME-AS;;;;;;;
;Benign lipomatous neoplasm of skin and subcutaneous tissue of trunk;;;;Diagnosis;N/A;;FALSE;ICD10-BD;D17.1;;SAME-AS;;;;;;;
;Benign lipomatous neoplasm of skin and subcutaneous tissue of limbs;;;;Diagnosis;N/A;;FALSE;ICD10-BD;D17.2;;SAME-AS;;;;;;;
;Benign lipomatous neoplasm of skin and subcutaneous tissue of other and unspecified sites;;;;Diagnosis;N/A;;FALSE;ICD10-BD;D17.3;;SAME-AS;;;;;;;
;Benign lipomatous neoplasm of intrathoracic organs;;;;Diagnosis;N/A;;FALSE;ICD10-BD;D17.4;;SAME-AS;;;;;;;
;Benign lipomatous neoplasm of intra-abdominal organs;;;;Diagnosis;N/A;;FALSE;ICD10-BD;D17.5;;SAME-AS;;;;;;;
;Benign lipomatous neoplasm of spermatic cord;;;;Diagnosis;N/A;;FALSE;ICD10-BD;D17.6;;SAME-AS;;;;;;;
;Benign lipomatous neoplasm of other sites;;;;Diagnosis;N/A;;FALSE;ICD10-BD;D17.7;;SAME-AS;;;;;;;
;Benign lipomatous neoplasm, unspecified;;;;Diagnosis;N/A;;FALSE;ICD10-BD;D17.9;;SAME-AS;;;;;;;
;Hemangioma and lymphangioma, any site;;;;Diagnosis;N/A;;FALSE;ICD10-BD;D18;;SAME-AS;;;;;;;
;Hemangioma, any site;;;;Diagnosis;N/A;;FALSE;ICD10-BD;D18.0;;SAME-AS;;;;;;;
;Lymphangioma, any site;;;;Diagnosis;N/A;;FALSE;ICD10-BD;D18.1;;SAME-AS;;;;;;;
;Benign neoplasm of mesothelial tissue;;;;Diagnosis;N/A;;FALSE;ICD10-BD;D19;;SAME-AS;;;;;;;
;Benign neoplasm of mesothelial tissue of pleura;;;;Diagnosis;N/A;;FALSE;ICD10-BD;D19.0;;SAME-AS;;;;;;;
;Benign neoplasm of mesothelial tissue of peritoneum;;;;Diagnosis;N/A;;FALSE;ICD10-BD;D19.1;;SAME-AS;;;;;;;
;Benign neoplasm of mesothelial tissue of other sites;;;;Diagnosis;N/A;;FALSE;ICD10-BD;D19.7;;SAME-AS;;;;;;;
;Benign neoplasm of mesothelial tissue, unspecified;;;;Diagnosis;N/A;;FALSE;ICD10-BD;D19.9;;SAME-AS;;;;;;;
;Benign neoplasm of soft tissue of retroperitoneum and peritoneum;;;;Diagnosis;N/A;;FALSE;ICD10-BD;D20;;SAME-AS;;;;;;;
;Benign neoplasm of retroperitoneum;;;;Diagnosis;N/A;;FALSE;ICD10-BD;D20.0;;SAME-AS;;;;;;;
;Benign neoplasm of peritoneum;;;;Diagnosis;N/A;;FALSE;ICD10-BD;D20.1;;SAME-AS;;;;;;;
;Other benign neoplasms of connective and other soft tissue;;;;Diagnosis;N/A;;FALSE;ICD10-BD;D21;;SAME-AS;;;;;;;
;Benign neoplasm of connective and other soft tissue of head, face, and neck;;;;Diagnosis;N/A;;FALSE;ICD10-BD;D21.0;;SAME-AS;;;;;;;
;Benign neoplasm of connective and other soft tissue of upper limb, including shoulder;;;;Diagnosis;N/A;;FALSE;ICD10-BD;D21.1;;SAME-AS;;;;;;;
;Benign neoplasm of connective and other soft tissue of lower limb, including hip;;;;Diagnosis;N/A;;FALSE;ICD10-BD;D21.2;;SAME-AS;;;;;;;
;Benign neoplasm of connective and other soft tissue of thorax;;;;Diagnosis;N/A;;FALSE;ICD10-BD;D21.3;;SAME-AS;;;;;;;
;Benign neoplasm of connective and other soft tissue of abdomen;;;;Diagnosis;N/A;;FALSE;ICD10-BD;D21.4;;SAME-AS;;;;;;;
;Benign neoplasm of connective and other soft tissue of pelvis;;;;Diagnosis;N/A;;FALSE;ICD10-BD;D21.5;;SAME-AS;;;;;;;
;Benign neoplasm of connective and other soft tissue of trunk, unspecified;;;;Diagnosis;N/A;;FALSE;ICD10-BD;D21.6;;SAME-AS;;;;;;;
;Benign neoplasm of connective and other soft tissue, unspecified;;;;Diagnosis;N/A;;FALSE;ICD10-BD;D21.9;;SAME-AS;;;;;;;
;Melanocytic nevi;;;;Diagnosis;N/A;;FALSE;ICD10-BD;D22;;SAME-AS;;;;;;;
;Melanocytic nevi of lip;;;;Diagnosis;N/A;;FALSE;ICD10-BD;D22.0;;SAME-AS;;;;;;;
;Melanocytic nevi of eyelid, including canthus;;;;Diagnosis;N/A;;FALSE;ICD10-BD;D22.1;;SAME-AS;;;;;;;
;Melanocytic nevi of ear and external auricular canal;;;;Diagnosis;N/A;;FALSE;ICD10-BD;D22.2;;SAME-AS;;;;;;;
;Melanocytic nevi of other and unspecified parts of face;;;;Diagnosis;N/A;;FALSE;ICD10-BD;D22.3;;SAME-AS;;;;;;;
;Melanocytic nevi of scalp and neck;;;;Diagnosis;N/A;;FALSE;ICD10-BD;D22.4;;SAME-AS;;;;;;;
;Melanocytic nevi of trunk;;;;Diagnosis;N/A;;FALSE;ICD10-BD;D22.5;;SAME-AS;;;;;;;
;Melanocytic nevi of upper limb, including shoulder;;;;Diagnosis;N/A;;FALSE;ICD10-BD;D22.6;;SAME-AS;;;;;;;
;Melanocytic nevi of lower limb, including hip;;;;Diagnosis;N/A;;FALSE;ICD10-BD;D22.7;;SAME-AS;;;;;;;
;Melanocytic nevi, unspecified;;;;Diagnosis;N/A;;FALSE;ICD10-BD;D22.9;;SAME-AS;;;;;;;
;Other benign neoplasms of skin;;;;Diagnosis;N/A;;FALSE;ICD10-BD;D23;;SAME-AS;;;;;;;
;Benign neoplasm of skin of lip;;;;Diagnosis;N/A;;FALSE;ICD10-BD;D23.0;;SAME-AS;;;;;;;
;Benign neoplasm of skin of eyelid, including canthus;;;;Diagnosis;N/A;;FALSE;ICD10-BD;D23.1;;SAME-AS;;;;;;;
;Benign neoplasm of skin of ear and external auricular canal;;;;Diagnosis;N/A;;FALSE;ICD10-BD;D23.2;;SAME-AS;;;;;;;
;Benign neoplasm of skin of other and unspecified parts of face;;;;Diagnosis;N/A;;FALSE;ICD10-BD;D23.3;;SAME-AS;;;;;;;
;Benign neoplasm of skin of scalp and neck;;;;Diagnosis;N/A;;FALSE;ICD10-BD;D23.4;;SAME-AS;;;;;;;
;Benign neoplasm of skin of trunk;;;;Diagnosis;N/A;;FALSE;ICD10-BD;D23.5;;SAME-AS;;;;;;;
;Benign neoplasm of skin of upper limb, including shoulder;;;;Diagnosis;N/A;;FALSE;ICD10-BD;D23.6;;SAME-AS;;;;;;;
;Benign neoplasm of skin of lower limb, including hip;;;;Diagnosis;N/A;;FALSE;ICD10-BD;D23.7;;SAME-AS;;;;;;;
;Benign neoplasm of skin, unspecified;;;;Diagnosis;N/A;;FALSE;ICD10-BD;D23.9;;SAME-AS;;;;;;;
;Benign neoplasm of breast;;;;Diagnosis;N/A;;FALSE;ICD10-BD;D24;;SAME-AS;;;;;;;
;Leiomyoma of uterus;;;;Diagnosis;N/A;;FALSE;ICD10-BD;D25;;SAME-AS;;;;;;;
;Submucous leiomyoma of uterus;;;;Diagnosis;N/A;;FALSE;ICD10-BD;D25.0;;SAME-AS;;;;;;;
;Intramural leiomyoma of uterus;;;;Diagnosis;N/A;;FALSE;ICD10-BD;D25.1;;SAME-AS;;;;;;;
;Subserosal leiomyoma of uterus;;;;Diagnosis;N/A;;FALSE;ICD10-BD;D25.2;;SAME-AS;;;;;;;
;Leiomyoma of uterus, unspecified;;;;Diagnosis;N/A;;FALSE;ICD10-BD;D25.9;;SAME-AS;;;;;;;
;Other benign neoplasms of uterus;;;;Diagnosis;N/A;;FALSE;ICD10-BD;D26;;SAME-AS;;;;;;;
;Benign neoplasm of cervix uteri;;;;Diagnosis;N/A;;FALSE;ICD10-BD;D26.0;;SAME-AS;;;;;;;
;Benign neoplasm of corpus uteri;;;;Diagnosis;N/A;;FALSE;ICD10-BD;D26.1;;SAME-AS;;;;;;;
;Benign neoplasm of other parts of uterus;;;;Diagnosis;N/A;;FALSE;ICD10-BD;D26.7;;SAME-AS;;;;;;;
;Benign neoplasm of uterus, unspecified;;;;Diagnosis;N/A;;FALSE;ICD10-BD;D26.9;;SAME-AS;;;;;;;
;Benign neoplasm of ovary;;;;Diagnosis;N/A;;FALSE;ICD10-BD;D27;;SAME-AS;;;;;;;
;Benign neoplasm of other and unspecified female genital organs;;;;Diagnosis;N/A;;FALSE;ICD10-BD;D28;;SAME-AS;;;;;;;
;Benign neoplasm of vulva;;;;Diagnosis;N/A;;FALSE;ICD10-BD;D28.0;;SAME-AS;;;;;;;
;Benign neoplasm of vagina;;;;Diagnosis;N/A;;FALSE;ICD10-BD;D28.1;;SAME-AS;;;;;;;
;Benign neoplasm of uterine tubes and ligaments;;;;Diagnosis;N/A;;FALSE;ICD10-BD;D28.2;;SAME-AS;;;;;;;
;Benign neoplasm of other specified female genital organs;;;;Diagnosis;N/A;;FALSE;ICD10-BD;D28.7;;SAME-AS;;;;;;;
;Benign neoplasm of female genital organ, unspecified;;;;Diagnosis;N/A;;FALSE;ICD10-BD;D28.9;;SAME-AS;;;;;;;
;Benign neoplasm of male genital organs;;;;Diagnosis;N/A;;FALSE;ICD10-BD;D29;;SAME-AS;;;;;;;
;Benign neoplasm of penis;;;;Diagnosis;N/A;;FALSE;ICD10-BD;D29.0;;SAME-AS;;;;;;;
;Benign neoplasm of prostate;;;;Diagnosis;N/A;;FALSE;ICD10-BD;D29.1;;SAME-AS;;;;;;;
;Benign neoplasm of testis;;;;Diagnosis;N/A;;FALSE;ICD10-BD;D29.2;;SAME-AS;;;;;;;
;Benign neoplasm of epididymis;;;;Diagnosis;N/A;;FALSE;ICD10-BD;D29.3;;SAME-AS;;;;;;;
;Benign neoplasm of scrotum;;;;Diagnosis;N/A;;FALSE;ICD10-BD;D29.4;;SAME-AS;;;;;;;
;Benign neoplasm of other male genital organs;;;;Diagnosis;N/A;;FALSE;ICD10-BD;D29.7;;SAME-AS;;;;;;;
;Benign neoplasm of male genital organ, unspecified;;;;Diagnosis;N/A;;FALSE;ICD10-BD;D29.9;;SAME-AS;;;;;;;
;Benign neoplasm of urinary organs;;;;Diagnosis;N/A;;FALSE;ICD10-BD;D30;;SAME-AS;;;;;;;
;Benign neoplasm of kidney;;;;Diagnosis;N/A;;FALSE;ICD10-BD;D30.0;;SAME-AS;;;;;;;
;Benign neoplasm of renal pelvis;;;;Diagnosis;N/A;;FALSE;ICD10-BD;D30.1;;SAME-AS;;;;;;;
;Benign neoplasm of ureter;;;;Diagnosis;N/A;;FALSE;ICD10-BD;D30.2;;SAME-AS;;;;;;;
;Benign neoplasm of bladder;;;;Diagnosis;N/A;;FALSE;ICD10-BD;D30.3;;SAME-AS;;;;;;;
;Benign neoplasm of urethra;;;;Diagnosis;N/A;;FALSE;ICD10-BD;D30.4;;SAME-AS;;;;;;;
;Benign neoplasm of other urinary organs;;;;Diagnosis;N/A;;FALSE;ICD10-BD;D30.7;;SAME-AS;;;;;;;
;Benign neoplasm of urinary organ, unspecified;;;;Diagnosis;N/A;;FALSE;ICD10-BD;D30.9;;SAME-AS;;;;;;;
;Benign neoplasm of eye and adnexa;;;;Diagnosis;N/A;;FALSE;ICD10-BD;D31;;SAME-AS;;;;;;;
;Benign neoplasm of conjunctiva;;;;Diagnosis;N/A;;FALSE;ICD10-BD;D31.0;;SAME-AS;;;;;;;
;Benign neoplasm of cornea;;;;Diagnosis;N/A;;FALSE;ICD10-BD;D31.1;;SAME-AS;;;;;;;
;Benign neoplasm of retina;;;;Diagnosis;N/A;;FALSE;ICD10-BD;D31.2;;SAME-AS;;;;;;;
;Benign neoplasm of choroid;;;;Diagnosis;N/A;;FALSE;ICD10-BD;D31.3;;SAME-AS;;;;;;;
;Benign neoplasm of ciliary body;;;;Diagnosis;N/A;;FALSE;ICD10-BD;D31.4;;SAME-AS;;;;;;;
;Benign neoplasm of lacrimal gland and duct;;;;Diagnosis;N/A;;FALSE;ICD10-BD;D31.5;;SAME-AS;;;;;;;
;Benign neoplasm of orbit, unspecified;;;;Diagnosis;N/A;;FALSE;ICD10-BD;D31.6;;SAME-AS;;;;;;;
;Benign neoplasm of eye, unspecified;;;;Diagnosis;N/A;;FALSE;ICD10-BD;D31.9;;SAME-AS;;;;;;;
;Benign neoplasm of meninges;;;;Diagnosis;N/A;;FALSE;ICD10-BD;D32;;SAME-AS;;;;;;;
;Benign neoplasm of cerebral meninges;;;;Diagnosis;N/A;;FALSE;ICD10-BD;D32.0;;SAME-AS;;;;;;;
;Benign neoplasm of spinal meninges;;;;Diagnosis;N/A;;FALSE;ICD10-BD;D32.1;;SAME-AS;;;;;;;
;Benign neoplasm of meninges, unspecified;;;;Diagnosis;N/A;;FALSE;ICD10-BD;D32.9;;SAME-AS;;;;;;;
;Benign neoplasm of brain and other parts of central nervous system;;;;Diagnosis;N/A;;FALSE;ICD10-BD;D33;;SAME-AS;;;;;;;
;Benign neoplasm of brain, supratentorial;;;;Diagnosis;N/A;;FALSE;ICD10-BD;D33.0;;SAME-AS;;;;;;;
;Benign neoplasm of brain, infratentorial;;;;Diagnosis;N/A;;FALSE;ICD10-BD;D33.1;;SAME-AS;;;;;;;
;Benign neoplasm of brain, unspecified;;;;Diagnosis;N/A;;FALSE;ICD10-BD;D33.2;;SAME-AS;;;;;;;
;Benign neoplasm of cranial nerves;;;;Diagnosis;N/A;;FALSE;ICD10-BD;D33.3;;SAME-AS;;;;;;;
;Benign neoplasm of spinal cord;;;;Diagnosis;N/A;;FALSE;ICD10-BD;D33.4;;SAME-AS;;;;;;;
;Benign neoplasm of other specified parts of central nervous system;;;;Diagnosis;N/A;;FALSE;ICD10-BD;D33.7;;SAME-AS;;;;;;;
;Benign neoplasm of central nervous system, unspecified;;;;Diagnosis;N/A;;FALSE;ICD10-BD;D33.9;;SAME-AS;;;;;;;
;Benign neoplasm of thyroid gland;;;;Diagnosis;N/A;;FALSE;ICD10-BD;D34;;SAME-AS;;;;;;;
;Benign neoplasm of other and unspecified endocrine glands;;;;Diagnosis;N/A;;FALSE;ICD10-BD;D35;;SAME-AS;;;;;;;
;Benign neoplasm of adrenal gland;;;;Diagnosis;N/A;;FALSE;ICD10-BD;D35.0;;SAME-AS;;;;;;;
;Benign neoplasm of parathyroid gland;;;;Diagnosis;N/A;;FALSE;ICD10-BD;D35.1;;SAME-AS;;;;;;;
;Benign neoplasm of pituitary gland;;;;Diagnosis;N/A;;FALSE;ICD10-BD;D35.2;;SAME-AS;;;;;;;
;Benign neoplasm of craniopharyngeal duct;;;;Diagnosis;N/A;;FALSE;ICD10-BD;D35.3;;SAME-AS;;;;;;;
;Benign neoplasm of pineal gland;;;;Diagnosis;N/A;;FALSE;ICD10-BD;D35.4;;SAME-AS;;;;;;;
;Benign neoplasm of carotid body;;;;Diagnosis;N/A;;FALSE;ICD10-BD;D35.5;;SAME-AS;;;;;;;
;Benign neoplasm of aortic body and other paraganglia;;;;Diagnosis;N/A;;FALSE;ICD10-BD;D35.6;;SAME-AS;;;;;;;
;Benign neoplasm of other specified endocrine glands;;;;Diagnosis;N/A;;FALSE;ICD10-BD;D35.7;;SAME-AS;;;;;;;
;Benign neoplasm of pluriglandular involvement;;;;Diagnosis;N/A;;FALSE;ICD10-BD;D35.8;;SAME-AS;;;;;;;
;Benign neoplasm of endocrine gland, unspecified;;;;Diagnosis;N/A;;FALSE;ICD10-BD;D35.9;;SAME-AS;;;;;;;
;Benign neoplasm of other and unspecified sites;;;;Diagnosis;N/A;;FALSE;ICD10-BD;D36;;SAME-AS;;;;;;;
;Benign neoplasm of lymph nodes;;;;Diagnosis;N/A;;FALSE;ICD10-BD;D36.0;;SAME-AS;;;;;;;
;Benign neoplasm of peripheral nerves and autonomic nervous system;;;;Diagnosis;N/A;;FALSE;ICD10-BD;D36.1;;SAME-AS;;;;;;;
;Benign neoplasm of other specified sites;;;;Diagnosis;N/A;;FALSE;ICD10-BD;D36.7;;SAME-AS;;;;;;;
;Benign neoplasm of benign neoplasm of unspecified site;;;;Diagnosis;N/A;;FALSE;ICD10-BD;D36.9;;SAME-AS;;;;;;;
;Neoplasm of uncertain or unknown behavior of oral cavity and digestive organs;;;;Diagnosis;N/A;;FALSE;ICD10-BD;D37;;SAME-AS;;;;;;;
;Neoplasm of uncertain behavior lip, oral cavity, and pharynx;;;;Diagnosis;N/A;;FALSE;ICD10-BD;D37.0;;SAME-AS;;;;;;;
;Neoplasm of uncertain behavior stomach;;;;Diagnosis;N/A;;FALSE;ICD10-BD;D37.1;;SAME-AS;;;;;;;
;Neoplasm of uncertain behavior small intestine;;;;Diagnosis;N/A;;FALSE;ICD10-BD;D37.2;;SAME-AS;;;;;;;
;Neoplasm of uncertain behavior appendix;;;;Diagnosis;N/A;;FALSE;ICD10-BD;D37.3;;SAME-AS;;;;;;;
